{
  "version": "cypher-llm-diagnostic-catalog/v1",
  "generatedAt": "2026-05-10",
  "packageName": "@evalops/cypher-llm-compiler",
  "packageVersion": "0.1.0",
  "entries": [
    {
      "code": "missing-return",
      "match": "exact",
      "title": "Missing RETURN",
      "severity": "warning",
      "source": "compiler-validation",
      "category": "syntax",
      "preferredAction": "apply-deterministic-repair",
      "preferredTool": "cypher_repair_plan",
      "description": "Generated reads should project an explicit result.",
      "modelInstruction": "Generated reads should project an explicit result. Apply deterministic compiler repair first, then re-run proof or agent feedback.",
      "evidencePaths": [
        "src/validate.ts",
        "test/compiler-loop.test.ts"
      ],
      "examplePaths": [
        "examples/agent/agent-guide.json"
      ]
    },
    {
      "code": "write-requires-approval",
      "match": "exact",
      "title": "Write Requires Approval",
      "severity": "error",
      "source": "compiler-validation",
      "category": "execution",
      "preferredAction": "request-approval",
      "preferredTool": "cypher_agent_feedback",
      "description": "Write clauses are blocked unless an external approval path is supplied.",
      "modelInstruction": "Write clauses are blocked unless an external approval path is supplied. Stop before execution and request an explicit external approval path.",
      "evidencePaths": [
        "src/validate.ts",
        "test/compiler-loop.test.ts"
      ],
      "examplePaths": [
        "examples/agent/agent-guide.json"
      ]
    },
    {
      "code": "raw-cypher-escape-hatch",
      "match": "exact",
      "title": "Raw Cypher Escape Hatch",
      "severity": "warning",
      "source": "compiler-validation",
      "category": "raw-compatibility",
      "preferredAction": "use-raw-migration",
      "preferredTool": "cypher_parse_lossless",
      "description": "Raw clauses are allowed only as explicit migration escape hatches.",
      "modelInstruction": "Raw clauses are allowed only as explicit migration escape hatches. Preserve source bytes and migrate toward structured IR only where supported.",
      "evidencePaths": [
        "src/validate.ts",
        "test/compiler-loop.test.ts"
      ],
      "examplePaths": [
        "examples/agent/agent-guide.json"
      ]
    },
    {
      "code": "raw-expression-escape-hatch",
      "match": "exact",
      "title": "Raw Expression Escape Hatch",
      "severity": "warning",
      "source": "compiler-validation",
      "category": "raw-compatibility",
      "preferredAction": "use-raw-migration",
      "preferredTool": "cypher_parse_lossless",
      "description": "Raw expressions should be migrated to typed IR where possible.",
      "modelInstruction": "Raw expressions should be migrated to typed IR where possible. Preserve source bytes and migrate toward structured IR only where supported.",
      "evidencePaths": [
        "src/validate.ts",
        "test/compiler-loop.test.ts"
      ],
      "examplePaths": [
        "examples/agent/agent-guide.json"
      ]
    },
    {
      "code": "aggregate-in-match-where",
      "match": "exact",
      "title": "Aggregate In MATCH WHERE",
      "severity": "error",
      "source": "compiler-validation",
      "category": "aggregation",
      "preferredAction": "regenerate-ir",
      "preferredTool": "cypher_validate",
      "description": "Aggregate predicates must move after WITH or RETURN.",
      "modelInstruction": "Aggregate predicates must move after WITH or RETURN. Regenerate the smallest affected IR subtree and preserve validated clauses.",
      "evidencePaths": [
        "src/validate.ts",
        "test/compiler-loop.test.ts"
      ],
      "examplePaths": [
        "examples/agent/agent-guide.json"
      ]
    },
    {
      "code": "aggregate-alias-required",
      "match": "exact",
      "title": "Aggregate Alias Required",
      "severity": "error",
      "source": "compiler-validation",
      "category": "aggregation",
      "preferredAction": "regenerate-ir",
      "preferredTool": "cypher_validate",
      "description": "Aggregate projections need stable aliases for later references.",
      "modelInstruction": "Aggregate projections need stable aliases for later references. Regenerate the smallest affected IR subtree and preserve validated clauses.",
      "evidencePaths": [
        "src/validate.ts",
        "test/compiler-loop.test.ts"
      ],
      "examplePaths": [
        "examples/agent/agent-guide.json"
      ]
    },
    {
      "code": "ambiguous-aggregation-expression",
      "match": "exact",
      "title": "Ambiguous Aggregation Expression",
      "severity": "error",
      "source": "compiler-validation",
      "category": "aggregation",
      "preferredAction": "regenerate-ir",
      "preferredTool": "cypher_validate",
      "description": "Mixed aggregate and scalar projections need explicit grouping shape.",
      "modelInstruction": "Mixed aggregate and scalar projections need explicit grouping shape. Regenerate the smallest affected IR subtree and preserve validated clauses.",
      "evidencePaths": [
        "src/validate.ts",
        "test/compiler-loop.test.ts"
      ],
      "examplePaths": [
        "examples/agent/agent-guide.json"
      ]
    },
    {
      "code": "invalid-aggregation",
      "match": "exact",
      "title": "Invalid Aggregation",
      "severity": "error",
      "source": "compiler-validation",
      "category": "aggregation",
      "preferredAction": "regenerate-ir",
      "preferredTool": "cypher_validate",
      "description": "Aggregation expression shape is not valid for the target IR.",
      "modelInstruction": "Aggregation expression shape is not valid for the target IR. Regenerate the smallest affected IR subtree and preserve validated clauses.",
      "evidencePaths": [
        "src/validate.ts",
        "test/compiler-loop.test.ts"
      ],
      "examplePaths": [
        "examples/agent/agent-guide.json"
      ]
    },
    {
      "code": "missing-procedure",
      "match": "exact",
      "title": "Missing Procedure Metadata",
      "severity": "warning",
      "source": "compiler-validation",
      "category": "schema",
      "preferredAction": "ask-for-schema",
      "preferredTool": "cypher_validate",
      "description": "Procedure calls need schema procedure metadata for full validation.",
      "modelInstruction": "Procedure calls need schema procedure metadata for full validation. Ask for schema metadata or use declared aliases; do not invent graph names.",
      "evidencePaths": [
        "src/validate.ts",
        "test/compiler-loop.test.ts"
      ],
      "examplePaths": [
        "examples/agent/agent-guide.json"
      ]
    },
    {
      "code": "unknown-procedure",
      "match": "exact",
      "title": "Unknown Procedure",
      "severity": "error",
      "source": "compiler-validation",
      "category": "schema",
      "preferredAction": "ask-for-schema",
      "preferredTool": "cypher_validate",
      "description": "The procedure is not declared in the schema contract.",
      "modelInstruction": "The procedure is not declared in the schema contract. Ask for schema metadata or use declared aliases; do not invent graph names.",
      "evidencePaths": [
        "src/validate.ts",
        "test/compiler-loop.test.ts"
      ],
      "examplePaths": [
        "examples/agent/agent-guide.json"
      ]
    },
    {
      "code": "unknown-procedure-yield",
      "match": "exact",
      "title": "Unknown Procedure YIELD",
      "severity": "error",
      "source": "compiler-validation",
      "category": "schema",
      "preferredAction": "ask-for-schema",
      "preferredTool": "cypher_validate",
      "description": "The procedure YIELD variable is not declared in schema metadata.",
      "modelInstruction": "The procedure YIELD variable is not declared in schema metadata. Ask for schema metadata or use declared aliases; do not invent graph names.",
      "evidencePaths": [
        "src/validate.ts",
        "test/compiler-loop.test.ts"
      ],
      "examplePaths": [
        "examples/agent/agent-guide.json"
      ]
    },
    {
      "code": "function-argument-mismatch",
      "match": "exact",
      "title": "Function Argument Mismatch",
      "severity": "error",
      "source": "compiler-validation",
      "category": "type",
      "preferredAction": "regenerate-ir",
      "preferredTool": "cypher_validate",
      "description": "Function call arguments do not match declared arity or type metadata.",
      "modelInstruction": "Function call arguments do not match declared arity or type metadata. Regenerate the smallest affected IR subtree and preserve validated clauses.",
      "evidencePaths": [
        "src/validate.ts",
        "test/compiler-loop.test.ts"
      ],
      "examplePaths": [
        "examples/agent/agent-guide.json"
      ]
    },
    {
      "code": "procedure-argument-mismatch",
      "match": "exact",
      "title": "Procedure Argument Mismatch",
      "severity": "error",
      "source": "compiler-validation",
      "category": "type",
      "preferredAction": "regenerate-ir",
      "preferredTool": "cypher_validate",
      "description": "Procedure call arguments do not match declared arity or type metadata.",
      "modelInstruction": "Procedure call arguments do not match declared arity or type metadata. Regenerate the smallest affected IR subtree and preserve validated clauses.",
      "evidencePaths": [
        "src/validate.ts",
        "test/compiler-loop.test.ts"
      ],
      "examplePaths": [
        "examples/agent/agent-guide.json"
      ]
    },
    {
      "code": "subquery-import-undefined",
      "match": "exact",
      "title": "Subquery Import Undefined",
      "severity": "error",
      "source": "compiler-validation",
      "category": "scope",
      "preferredAction": "regenerate-ir",